{
  "$schema": "https://json-schema.org/draft/2020-12/schema",
  "type": "object",
  "properties": {
    "schema_version": {
      "$ref": "#/$defs/__schema0"
    },
    "document_kind": {
      "$ref": "#/$defs/__schema1"
    },
    "id": {
      "$ref": "#/$defs/__schema2"
    },
    "invocation_id": {
      "$ref": "#/$defs/__schema3"
    },
    "name": {
      "$ref": "#/$defs/__schema4"
    },
    "status": {
      "$ref": "#/$defs/__schema5"
    },
    "started_at": {
      "$ref": "#/$defs/__schema6"
    },
    "ended_at": {
      "$ref": "#/$defs/__schema8"
    },
    "duration_ms": {
      "$ref": "#/$defs/__schema9"
    },
    "evidence": {
      "$ref": "#/$defs/__schema10"
    },
    "failure": {
      "$ref": "#/$defs/__schema13"
    }
  },
  "required": [
    "schema_version",
    "document_kind",
    "id",
    "invocation_id",
    "name",
    "status",
    "started_at",
    "ended_at",
    "duration_ms",
    "evidence",
    "failure"
  ],
  "additionalProperties": false,
  "$defs": {
    "__schema0": {
      "type": "string",
      "const": "kensa.protocol.v1"
    },
    "__schema1": {
      "type": "string",
      "const": "check_result"
    },
    "__schema2": {
      "type": "string",
      "pattern": "^chk_[0-9a-f]{8}-[0-9a-f]{4}-7[0-9a-f]{3}-[89ab][0-9a-f]{3}-[0-9a-f]{12}$"
    },
    "__schema3": {
      "type": "string",
      "pattern": "^inv_[0-9a-f]{8}-[0-9a-f]{4}-7[0-9a-f]{3}-[89ab][0-9a-f]{3}-[0-9a-f]{12}$"
    },
    "__schema4": {
      "type": "string",
      "minLength": 1
    },
    "__schema5": {
      "type": "string",
      "enum": ["pass", "fail", "error", "skipped"]
    },
    "__schema6": {
      "anyOf": [
        {
          "$ref": "#/$defs/__schema7"
        },
        {
          "type": "null"
        }
      ]
    },
    "__schema7": {
      "type": "string"
    },
    "__schema8": {
      "anyOf": [
        {
          "$ref": "#/$defs/__schema7"
        },
        {
          "type": "null"
        }
      ]
    },
    "__schema9": {
      "anyOf": [
        {
          "type": "integer",
          "minimum": 0,
          "maximum": 9007199254740991
        },
        {
          "type": "null"
        }
      ]
    },
    "__schema10": {
      "type": "object",
      "propertyNames": {
        "$ref": "#/$defs/__schema11"
      },
      "additionalProperties": {
        "$ref": "#/$defs/__schema12"
      }
    },
    "__schema11": {
      "type": "string"
    },
    "__schema12": {
      "anyOf": [
        {
          "type": "string"
        },
        {
          "type": "number"
        },
        {
          "type": "boolean"
        },
        {
          "type": "null"
        },
        {
          "type": "array",
          "items": {
            "$ref": "#/$defs/__schema12"
          }
        },
        {
          "type": "object",
          "propertyNames": {
            "type": "string"
          },
          "additionalProperties": {
            "$ref": "#/$defs/__schema12"
          }
        }
      ]
    },
    "__schema13": {
      "anyOf": [
        {
          "type": "object",
          "properties": {
            "category": {
              "type": "string",
              "enum": [
                "agent",
                "simulator",
                "judge",
                "configuration",
                "infrastructure",
                "harness",
                "unknown"
              ]
            },
            "kind": {
              "$ref": "#/$defs/__schema4"
            },
            "message": {
              "$ref": "#/$defs/__schema4"
            },
            "evidence": {
              "$ref": "#/$defs/__schema10"
            }
          },
          "required": ["category", "kind", "message", "evidence"],
          "additionalProperties": false
        },
        {
          "type": "null"
        }
      ]
    }
  }
}
